{
  "$schema": "https://the-aico.com/schema/config.json",
  "defaultPlatform": "claude-code",
  "platforms": {
    "claude-code": {
      "skills": ".claude/skills",
      "commands": ".claude/commands"
    },
    "codex": {
      "skills": ".codex/skills",
      "commands": "~/.codex/prompts"
    }
  },
  "employees": {
    "pm": {
      "installedAt": "2026-01-21T11:28:13.304Z",
      "skills": [
        "init",
        "brainstorming",
        "user-story-writing",
        "prd-writing",
        "clarification",
        "acceptance-criteria",
        "competitor-analysis",
        "story-acceptance"
      ],
      "commands": ["init", "plan", "clarify"]
    },
    "frontend": {
      "installedAt": "2026-01-21T11:28:13.576Z",
      "skills": [
        "init",
        "style-extraction",
        "design",
        "task-breakdown",
        "plan",
        "implement"
      ],
      "commands": ["init", "design", "tasks", "plan"]
    },
    "backend": {
      "installedAt": "2026-01-21T11:28:13.914Z",
      "skills": ["init", "task-breakdown", "plan", "implement"],
      "commands": ["init", "tasks", "plan"]
    }
  },
  "skills": {},
  "sharedSkills": {
    "@the-aico/_shared/code-review": {
      "version": "1.0.0",
      "installedAt": "2026-01-12T13:59:13.458Z",
      "usedBy": ["frontend", "backend"]
    },
    "@the-aico/_shared/subagent-driven": {
      "version": "1.0.0",
      "installedAt": "2026-01-12T13:59:13.459Z",
      "usedBy": ["frontend", "backend"]
    },
    "@the-aico/_shared/worktree": {
      "version": "1.0.0",
      "installedAt": "2026-01-12T13:59:13.460Z",
      "usedBy": ["frontend", "backend"]
    }
  },
  "registries": {
    "@the-aico": "file://./registry/{name}.json"
  }
}
